<?xml version="1.0" encoding="UTF-8"?>
<!DOCTYPE ST26SequenceListing PUBLIC "-//WIPO//DTD Sequence Listing 1.3//EN" "ST26SequenceListing_V1_3.dtd">
<ST26SequenceListing dtdVersion="V1_3" fileName="EX-0001配列表.xml" softwareName="WIPO Sequence" softwareVersion="2.3.0" productionDate="2024-04-08" originalFreeTextLanguageCode="ja" nonEnglishFreeTextLanguageCode="ja">
	<ApplicationIdentification>
		<IPOfficeCode>JP</IPOfficeCode>
		<ApplicationNumberText>2024-135845</ApplicationNumberText>
		<FilingDate>2024-08-16</FilingDate>
	</ApplicationIdentification>
	<ApplicantFileReference>EX-0001</ApplicantFileReference>
	<EarliestPriorityApplicationIdentification>
		<IPOfficeCode>US</IPOfficeCode>
		<ApplicationNumberText>62/867,171</ApplicationNumberText>
		<FilingDate>2019-06-26</FilingDate>
	</EarliestPriorityApplicationIdentification>
	<ApplicantName languageCode="ja">見本製薬株式会社</ApplicantName>
	<ApplicantNameLatin>MIHON PHARMACEUTICAL CO., LTD.</ApplicantNameLatin>
	<InventorName languageCode="ja">見本　太郎</InventorName>
	<InventorNameLatin>MIHON Taro</InventorNameLatin>
	<InventionTitle languageCode="ja">見本の発明</InventionTitle>
	<InventionTitle languageCode="en">Exemplary invention</InventionTitle>
	<SequenceTotalQuantity>2</SequenceTotalQuantity>
	<SequenceData sequenceIDNumber="1">
		<INSDSeq>
			<INSDSeq_length>12</INSDSeq_length>
			<INSDSeq_moltype>DNA</INSDSeq_moltype>
			<INSDSeq_division>PAT</INSDSeq_division>
			<INSDSeq_other-seqids>
				<INSDSeqid>pat|JP|2025012345|A|1</INSDSeqid>
			</INSDSeq_other-seqids>
			<INSDSeq_feature-table>
				<INSDFeature>
					<INSDFeature_key>source</INSDFeature_key>
					<INSDFeature_location>1..12</INSDFeature_location>
					<INSDFeature_quals>
						<INSDQualifier>
							<INSDQualifier_name>mol_type</INSDQualifier_name>
							<INSDQualifier_value>other DNA</INSDQualifier_value>
						</INSDQualifier>
						<INSDQualifier id="q1">
							<INSDQualifier_name>organism</INSDQualifier_name>
							<INSDQualifier_value>synthetic construct</INSDQualifier_value>
						</INSDQualifier>
					</INSDFeature_quals>
				</INSDFeature>
			</INSDSeq_feature-table>
			<INSDSeq_sequence>acgtacgtacgt</INSDSeq_sequence>
		</INSDSeq>
	</SequenceData>
	<SequenceData sequenceIDNumber="2">
		<INSDSeq>
			<INSDSeq_length/>
			<INSDSeq_moltype/>
			<INSDSeq_division/>
			<INSDSeq_sequence>000</INSDSeq_sequence>
		</INSDSeq>
	</SequenceData>
	<Bibliography>
		<PublishedDate>20241203</PublishedDate>
		<PriorityCountry>US</PriorityCountry>
		<PriorityNumber>62/867,171</PriorityNumber>
		<PriorityDate>20190626</PriorityDate>
	</Bibliography>
</ST26SequenceListing>
