<?xml version="1.0" encoding="UTF-8"?>
<!DOCTYPE ST26SequenceListing PUBLIC "-//WIPO//DTD Sequence Listing 1.3//EN" "ST26SequenceListing_V1_3.dtd">
<ST26SequenceListing originalFreeTextLanguageCode="en" nonEnglishFreeTextLanguageCode="ru" dtdVersion="V1_3" fileName="Exemplary DNA and AA project" softwareName="WIPO Sequence" softwareVersion="1.1.0-beta4" productionDate="2021-06-11">
	<ApplicationIdentification>
		<IPOfficeCode>US</IPOfficeCode>
		<ApplicationNumberText>14/999,999</ApplicationNumberText>
		<FilingDate>2021-02-01</FilingDate>
	</ApplicationIdentification>
	<ApplicantFileReference>AB123</ApplicantFileReference>
	<EarliestPriorityApplicationIdentification>
		<IPOfficeCode>IB</IPOfficeCode>
		<ApplicationNumberText>PCT/IB2014</ApplicationNumberText>
		<FilingDate>2020-02-01</FilingDate>
	</EarliestPriorityApplicationIdentification>
	<ApplicantName languageCode="en">Том Джонс</ApplicantName>
	<ApplicantNameLatin>Tom Jons</ApplicantNameLatin>
	<InventorName languageCode="ru">Василий Иванов</InventorName>
	<InventorNameLatin>Vasiliy Ivanov</InventorNameLatin>
	<InventionTitle languageCode="en">Copolymer including uncharged hydropfilic block</InventionTitle>
	<SequenceTotalQuantity>2</SequenceTotalQuantity>
	<SequenceData sequenceIDNumber="1">
		<INSDSeq>
			<INSDSeq_length>21</INSDSeq_length>
			<INSDSeq_moltype>DNA</INSDSeq_moltype>
			<INSDSeq_division>PAT</INSDSeq_division>
			<INSDSeq_feature-table>
				<INSDFeature>
					<INSDFeature_key>source</INSDFeature_key>
					<INSDFeature_location>1..21</INSDFeature_location>
					<INSDFeature_quals>
						<INSDQualifier>
							<INSDQualifier_name>mol_type</INSDQualifier_name>
							<INSDQualifier_value>other DNA</INSDQualifier_value>
						</INSDQualifier>
						<INSDQualifier id="q2">
							<INSDQualifier_name>note</INSDQualifier_name>
							<INSDQualifier_value>Free Text</INSDQualifier_value>
							<NonEnglishQualifier_value>Свободный текст</NonEnglishQualifier_value>
						</INSDQualifier>
						<INSDQualifier id="q3">
							<INSDQualifier_name>organism</INSDQualifier_name>
							<INSDQualifier_value>synthetic construct</INSDQualifier_value>
							<NonEnglishQualifier_value>искусственная последовательность</NonEnglishQualifier_value>
						</INSDQualifier>
					</INSDFeature_quals>
				</INSDFeature>
			</INSDSeq_feature-table>
			<INSDSeq_sequence>atagatagatagatgwrtkhg</INSDSeq_sequence>
		</INSDSeq>
	</SequenceData>
	<SequenceData sequenceIDNumber="2">
		<INSDSeq>
			<INSDSeq_length>21</INSDSeq_length>
			<INSDSeq_moltype>AA</INSDSeq_moltype>
			<INSDSeq_division>PAT</INSDSeq_division>
			<INSDSeq_feature-table>
				<INSDFeature>
					<INSDFeature_key>source</INSDFeature_key>
					<INSDFeature_location>1..21</INSDFeature_location>
					<INSDFeature_quals>
						<INSDQualifier>
							<INSDQualifier_name>mol_type</INSDQualifier_name>
							<INSDQualifier_value>protein</INSDQualifier_value>
						</INSDQualifier>
						<INSDQualifier id="q5">
							<INSDQualifier_name>organism</INSDQualifier_name>
							<INSDQualifier_value>Homo sapiens</INSDQualifier_value>
							<NonEnglishQualifier_value>Человек разумный</NonEnglishQualifier_value>
						</INSDQualifier>
					</INSDFeature_quals>
				</INSDFeature>
			</INSDSeq_feature-table>
			<INSDSeq_sequence>ATAGATAGATAGATGWRTKHG</INSDSeq_sequence>
		</INSDSeq>
	</SequenceData>
</ST26SequenceListing>
